title,link,snippet,source,search_timestamp,price,address
"42 Lindbergh Ave, Newton, MA 02465",https://www.zillow.com/homedetails/42-Lindbergh-Ave-Newton-MA-02465/56308309_zpid/,"ATTENTON DEVEOPERS & CONTRACTORS this property is a prime opportunity for those seeking a teardown project. the home sits on an 8,276-square ...",zillow,2025-10-23 17:04:01,,"42 Lindbergh Ave, Newton, MA 02465"
"253 Nahanton St, Newton, MA 02459",https://www.zillow.com/homedetails/253-Nahanton-St-Newton-MA-02459/56323741_zpid/,"253 Nahanton St, Newton, MA 02459 is an apartment unit listed for rent at $9000 /mo. The 4700 Square Feet unit is a 5 beds, 5 baths apartment unit.",zillow,2025-10-23 17:04:01,9000.0,"253 Nahanton St, Newton, MA 02459"
"371 Cherry St, Newton, MA 02465 | MLS #73437218",https://www.zillow.com/homedetails/371-Cherry-St-Newton-MA-02465/56308230_zpid/,"Rare WEST NEWTON opportunity for BUILDERS, INVESTORS, or OWNER-OCCUPIERS seeking FLEXIBILITY. Set on an 8,810 SF lot in MR1 zoning, this property offers ...",zillow,2025-10-23 17:04:01,,"371 Cherry St, Newton, MA 02465"
"97 Hawthorne Ave, Newton, MA 02466 | MLS #73436798",https://www.zillow.com/homedetails/97-Hawthorne-Ave-Newton-MA-02466/56311004_zpid/,"Zillow has 20 photos of this $799000 3 beds, 1 bath, 1212 sqft single family home located at 97 Hawthorne Ave, Newton, MA 02466 built in ...",zillow,2025-10-23 17:04:01,799000.0,"97 Hawthorne Ave, Newton, MA 02466"
"299 Mill St, Newton, MA 02460",https://www.zillow.com/homedetails/299-Mill-St-Newton-MA-02460/56305598_zpid/,"299 Mill St, Newton, MA 02460 is a single-family home listed for rent at $6800 /mo. The 2300 Square Feet home is a 4 beds, 3 baths single-family home.",zillow,2025-10-23 17:04:01,6800.0,"299 Mill St, Newton, MA 02460"
"132 Brandeis Rd, Newton, MA 02459",https://www.zillow.com/homedetails/132-Brandeis-Rd-Newton-MA-02459/56321316_zpid/,"132 Brandeis Rd, Newton, MA 02459 is a single-family home listed for rent at $6250 /mo. The 2347 Square Feet home is a 4 beds, 3 baths single-family home.",zillow,2025-10-23 17:04:01,6250.0,"132 Brandeis Rd, Newton, MA 02459"
"48 Woodward St, Newton, MA 02461",https://www.zillow.com/homedetails/48-Woodward-St-Newton-MA-02461/56535776_zpid/,"48 Woodward St, Newton, MA 02461 is a single-family home listed for rent at $9950 /mo. The 4237 Square Feet home is a 5 beds, 5 baths single-family home.",zillow,2025-10-23 17:04:01,9950.0,"48 Woodward St, Newton, MA 02461"
"11 Rockland Pl, Newton, MA 02464",https://www.zillow.com/homedetails/11-Rockland-Pl-Newton-MA-02464/56311914_zpid/,"11 Rockland Pl, Newton, MA 02464 is a single-family home listed for rent at $4950 /mo. The 1816 Square Feet home is a 4 beds, 3 baths single-family home.",zillow,2025-10-23 17:04:01,4950.0,"11 Rockland Pl, Newton, MA 02464"
"85 Warren St, Newton, MA 02459",https://www.zillow.com/homedetails/85-Warren-St-Newton-MA-02459/56317687_zpid/,"85 Warren St, Newton, MA 02459 is a single-family home listed for rent at $4500 /mo. The 1248 Square Feet home is a 3 beds, 2 baths single-family home.",zillow,2025-10-23 17:04:01,4500.0,"85 Warren St, Newton, MA 02459"
"66 Forest Ave, West Newton, MA 02465",https://www.zillow.com/homedetails/66-Forest-Ave-West-Newton-MA-02465/456067420_zpid/,"66 Forest Ave, West Newton, MA 02465 is a single-family home listed for rent at $30000 /mo. The 8700 Square Feet home is a 6 beds, ...",zillow,2025-10-23 17:04:01,30000.0,"66 Forest Ave, West Newton, MA 02465"
"Homes for Sale in Newton, MA with a Large Lot",https://www.realtor.com/realestateandhomes-search/Newton_MA/with_biglot,"See 9 homes for sale with a large lot in Newton, MA. Explore real estate listings and find your dream home.",realtor,2025-10-23 17:04:02,,"Homes for Sale in Newton, MA with a Large Lot"
"Newton, MA Land & Lots for Sale",https://www.realtor.com/realestateandhomes-search/Newton_MA/type-land,"Browse 12 land & lots for sale in Newton, MA. View photos, listing details, and find your ideal property.",realtor,2025-10-23 17:04:02,,"Newton, MA Land & Lots for Sale"
"Large Yard - Newton, MA Homes for Sale",https://www.redfin.com/city/11619/MA/Newton/amenity/large+yard,"There are currently 3 homes for sale matching large yard in Newton at a median listing price of $1.71M. ... Some of these homes are ""Hot Homes,"" meaning they're ...",redfin,2025-10-23 17:04:02,1.0,"Large Yard - Newton, MA Homes for Sale"
"Homes for Sale in Newtonville, Newton with a Large Lot",https://www.realtor.com/realestateandhomes-search/Newtonville_Newton_MA/with_biglot,"Homes for sale in Newtonville, Newton, MA have a median listing home price of $2,348,500. There are 1 active homes for sale in Newtonville, Newton, MA, which ...",realtor,2025-10-23 17:04:02,2348500.0,"Homes for Sale in Newtonville, Newton with a Large Lot"
"Fixer Upper Homes for Sale in Newton, MA",https://www.realtor.com/realestateandhomes-search/Newton_MA/with_fixerupper,"See 1 fixer upper homes for sale in Newton, MA. Explore real estate listings and find your dream home.",realtor,2025-10-23 17:04:02,,"Fixer Upper Homes for Sale in Newton, MA"
New Construction Homes for Sale in Newton Corner ...,https://www.realtor.com/realestateandhomes-search/Newton-Corner_Newton_MA/shw-nc,"New construction homes for sale in Newton Corner, Newton, MA have a median listing home price of $1,249,995. There are 4 new construction homes for sale in ...",realtor,2025-10-23 17:04:02,1249995.0,New Construction Homes for Sale in Newton Corner ...
"Price Reduced Homes for Sale in Newton, MA - Realtor.com",https://www.realtor.com/realestateandhomes-search/Newton_MA/show-price-reduced,"Explore 69 price reduced homes for sale in Newton, MA. Browse property photos, details, and great deals on homes with recent price cuts.",realtor,2025-10-23 17:04:02,,"Price Reduced Homes for Sale in Newton, MA - Realtor.com"
"Homes for Sale in West Newton, MA with a Large Lot",https://www.realtor.com/realestateandhomes-search/West-Newton_MA/with_biglot,"Homes for sale in West Newton, MA with a large lot ; View properties in neighborhood Newton. Newton. $583 · $1,680,000 · See 17 matching homes ; View properties in ...",realtor,2025-10-23 17:04:02,583.0,"Homes for Sale in West Newton, MA with a Large Lot"
"Homes for Sale with 3 Garages in Newton, MA - Realtor.com",https://www.realtor.com/realestateandhomes-search/Newton_MA/with_3cargarage,"View 15 homes for sale with 3 or more garages in Newton, MA. Find properties with ample parking and storage space.",realtor,2025-10-23 17:04:02,,"Homes for Sale with 3 Garages in Newton, MA - Realtor.com"
"55+ Community Homes for Sale in Newton, MA",https://www.realtor.com/realestateandhomes-search/Newton_MA/show-55-plus,"View retirement community homes for sale in Newton, MA. Find comfortable homes designed for senior living on Realtor.com®.",realtor,2025-10-23 17:04:02,,"55+ Community Homes for Sale in Newton, MA"
Newton MA Real Estate & Homes For Sale,https://www.zillow.com/newton-ma/,"Zillow has 235 homes for sale in Newton MA. View listing photos, review sales history, and use our detailed real estate filters to find the perfect place.",zillow,2025-10-23 17:04:03,,Newton MA Real Estate & Homes For Sale
"New homes for sale & real estate in Newton, MA",https://www.redfin.com/city/11619/MA/Newton/new-homes,"New Home for sale in Newton, MA: Welcome to 180 Hunnewell Ave, a luxury new construction development in Newton Corner by one of Newton's premier developers.",redfin,2025-10-23 17:04:03,,"New homes for sale & real estate in Newton, MA"
New Construction Homes in Newton MA,https://www.zillow.com/newton-ma/new-homes/,"Discover new construction homes or master planned communities in Newton MA. Check out floor plans, pictures and videos for these new homes, and then get in ...",zillow,2025-10-23 17:04:03,,New Construction Homes in Newton MA
"Newton, MA Homes for Sale & Real Estate",https://www.redfin.com/city/11619/MA/Newton,"Search 259 homes for sale in Newton and book a home tour instantly with a Redfin agent. Updated every 5 minutes, get the latest on property info, ...",redfin,2025-10-23 17:04:03,,"Newton, MA Homes for Sale & Real Estate"
"Land for Sale in Newton, MA",https://www.redfin.com/city/11619/MA/Newton/land,"An unbelievable opportunity to develop single family homes in Newton Centre! One single family home on Lot 2 and one s. $1,250,000. — beds— baths— sq ft. Lot 3 ...",redfin,2025-10-23 17:04:03,1250000.0,"Land for Sale in Newton, MA"
"New Construction - Newton, MA Homes for Sale",https://www.redfin.com/city/11619/MA/Newton/amenity/new+construction,"Find Newton, MA homes for sale matching New Construction. Discover photos, open house information, and listing details for listings matching New ...",redfin,2025-10-23 17:04:03,,"New Construction - Newton, MA Homes for Sale"
West Newton Newton Real Estate & Homes For Sale,https://www.zillow.com/west-newton-newton-ma/,"Zillow has 24 homes for sale in West Newton Newton. View listing photos, review sales history, and use our detailed real estate filters to find the perfect ...",zillow,2025-10-23 17:04:03,,West Newton Newton Real Estate & Homes For Sale
Newton MA Condos & Apartments For Sale - 58 Listings,https://www.zillow.com/newton-ma/condos/,View photos of the 58 condos and apartments listed for sale in Newton MA. Find the perfect building to live in by filtering to your preferences.,zillow,2025-10-23 17:04:03,,Newton MA Condos & Apartments For Sale - 58 Listings
Newton MA Townhomes & Townhouses For Sale - Zillow,https://www.zillow.com/newton-ma/townhomes/,"Check out the townhomes currently on the market in Newton MA. View pictures, check Zestimates, and get scheduled for a tour.",zillow,2025-10-23 17:04:03,,Newton MA Townhomes & Townhouses For Sale - Zillow
"Four Corners, MA homes for sale & real estate - Redfin",https://www.redfin.com/neighborhood/58739/MA/Newton-Center/Four-Corners,"An unbelievable opportunity to develop single family homes in Newton Centre! One single family home on Lot 2 and one s. $1,250,000. — beds— baths— sq ft. Lot 3 ...",redfin,2025-10-23 17:04:03,1250000.0,"Four Corners, MA homes for sale & real estate - Redfin"
